<!ELEMENT USUARIOS ((USUARIO+))>
<!ELEMENT USUARIO ((NOMBRE, EDAD, NICK, PASSWORD))>
<!ATTLIST USUARIO
	id (003 | 002 | 001) #REQUIRED
	tipo (PROFESOR | ALUMNO | ADMINISTRADOR) #REQUIRED
>
<!ELEMENT PASSWORD (#PCDATA)>
<!ELEMENT NOMBRE (#PCDATA)>
<!ELEMENT NICK (#PCDATA)>
<!ELEMENT EDAD (#PCDATA)>
